<!ELEMENT Mydevices (device+)>
<!ELEMENT device (name,brand,model)>
<!ELEMENT name (#PCDATA)>
<!ELEMENT brand (#PCDATA)>
<!ELEMENT model (#PCDATA)>